{"$schema":"https://json-schema.org/draft/2020-12/schema","$id":"https://insurancereviewlab.com/schemas/publication.schema.json","title":"IRL Publication","type":"object","additionalProperties":false,"required":["publication_id","draft_id","brief_id","report_id","decision_id","strategy_id","seo_strategy_id","seo_validation_id","review_id","schema_version","lifecycle_stage","gate_status","publication_status","evidence_refs","audit"],"properties":{"publication_id":{"type":"string","minLength":1},"draft_id":{"type":"string","minLength":1},"brief_id":{"type":"string","minLength":1},"report_id":{"type":"string","minLength":1},"decision_id":{"type":"string","minLength":1},"strategy_id":{"type":"string","minLength":1},"seo_strategy_id":{"type":"string","minLength":1},"seo_validation_id":{"type":"string","minLength":1},"review_id":{"type":"string","minLength":1},"schema_version":{"const":"1.0"},"lifecycle_stage":{"const":"publication_ready"},"gate_status":{"enum":["allowed","blocked"]},"publication_status":{"enum":["ready","blocked"]},"evidence_refs":{"type":"array","minItems":1,"uniqueItems":true,"items":{"type":"string","minLength":1}},"audit":{"type":"object","additionalProperties":false,"required":["method","version","validation_status"],"properties":{"method":{"type":"string","minLength":1},"version":{"type":"string","minLength":1},"validation_status":{"const":"validated"}}}}}